{
  "$schema": "https://schemas.unifold.org/ui-module-lock/1.0/schema.json",
  "artifactIntegrity": "sha256-OATbr3syQMe24Mb5em3WVpb7a6jPGTjbmLpuFjBvQjI",
  "entry": {
    "exportName": "application",
    "moduleId": "org.unifold.examples.hierarchical-application",
    "version": "1.0.0"
  },
  "irIntegrity": "sha256-lEpzjsrtTnQuDPkeGFa_rLrg7x6pngl6CshwD3IZeBg",
  "modules": [
    {
      "integrity": "sha256-GIiuXYrd9lDdn6zSlRYZCIyctdyAf3JgHsVGMjU6_AE",
      "moduleId": "org.unifold.examples.hierarchical-application",
      "namespace": "",
      "sourceId": "src/modules/application.module.json",
      "version": "1.0.0"
    },
    {
      "integrity": "sha256-zUJUJzB-4FqZ8Y14WS1-4jfnyDO7SISCr3WZ09d7ahw",
      "moduleId": "org.unifold.examples.hierarchical-layouts",
      "namespace": "layouts",
      "sourceId": "src/modules/layouts.module.json",
      "version": "1.0.0"
    }
  ],
  "schemaVersion": "1.0.0"
}
