{
  "$schema": "https://schemas.unifold.org/ui-module-lock/1.0/schema.json",
  "artifactIntegrity": "sha256-pWn1pNQyqpmUpWVhsXEsoFN6yLr6t4sWKV0Rqumet_s",
  "entry": {
    "exportName": "application",
    "moduleId": "org.unifold.studio.control",
    "version": "1.0.0"
  },
  "irIntegrity": "sha256-C-7MXAkuSLYQl1tKmrQG1ESejjjNUsHSbczJS_16WLU",
  "modules": [
    {
      "integrity": "sha256-DZHhYdnAPhwSWxyju0zdJqIwICmIv2Z43KXdQc1U__A",
      "moduleId": "org.unifold.studio.control",
      "namespace": "",
      "sourceId": "src/modules/control.module.json",
      "version": "1.0.0"
    },
    {
      "integrity": "sha256-3ZOkhKxr2Uf9_-DuF3Z31yFLzCVpv9AUfigIa_5ta5w",
      "moduleId": "org.unifold.studio.presentation",
      "namespace": "presentation",
      "sourceId": "src/modules/presentation.module.json",
      "version": "1.0.0"
    }
  ],
  "schemaVersion": "1.0.0"
}
