{
  "$schema": "https://schemas.unifold.org/ui-module-lock/1.0/schema.json",
  "artifactIntegrity": "sha256-BAEVUa0kZ2J28GCxgsvOfyjFv66ymTdZJwXf9hUKPJs",
  "entry": {
    "exportName": "application",
    "moduleId": "org.unifold.reference.application",
    "version": "1.0.0"
  },
  "irIntegrity": "sha256-aOuxr0EcAMjhPn2zzvZEwUapjvcmq_Ifkm1Zx082RJc",
  "modules": [
    {
      "integrity": "sha256-OLtrXmoHtYNFlZJZZaa6bimM15vShCMib4oOfdMSxUc",
      "moduleId": "org.unifold.reference.application",
      "namespace": "",
      "sourceId": "src/modules/application.module.json",
      "version": "1.0.0"
    },
    {
      "integrity": "sha256-YqH8tn_K_hGGNGPTe8RUDVkGjyImF7p6C5zDWmDoaVo",
      "moduleId": "org.unifold.reference.profile",
      "namespace": "profile",
      "sourceId": "src/modules/profile.module.json",
      "version": "1.0.0"
    }
  ],
  "schemaVersion": "1.0.0"
}
